{"category_precedence":["vendor","generated","test","example","docs"],"exclusion_matchers":[{"category":"vendor","id":"path.vendor_component@1","operator":"component_equals_any","values":["third_party","vendor","vendored"]},{"category":"generated","id":"path.generated_component@1","operator":"component_equals_any","values":["generated","target"]},{"category":"generated","id":"path.generated_suffix@1","operator":"basename_suffix_any","values":[".generated.rs"]},{"category":"test","id":"path.test_component@1","operator":"component_equals_any","values":["benches","tests"]},{"category":"test","id":"path.test_basename@1","operator":"basename_equals_any","values":["test.rs","tests.rs"]},{"category":"test","id":"path.test_suffix@1","operator":"basename_suffix_any","values":["_test.rs","_tests.rs"]},{"category":"example","id":"path.example_component@1","operator":"component_equals_any","values":["example","examples"]},{"category":"docs","id":"path.docs_component@1","operator":"component_equals_any","values":["doc","docs"]}],"id":"rust.production.v1","path_normalization":{"absolute":"reject","backslash":"reject","case_fold":false,"dot":"reject","dot_dot":"reject","empty_component":"reject","encoding":"utf-8","nul":"reject","separator":"/","unicode_normalization":"none"},"reason_ids":{"docs":"profile.exclude.docs@1","example":"profile.exclude.example@1","generated":"profile.exclude.generated@1","test":"profile.exclude.test@1","vendor":"profile.exclude.vendor@1"},"rust_source":{"basename_suffix":".rs","case_sensitive":true},"schema":"reviewgraphen.review_profile.v1"}